{
  "schema": "mak-cross-domain-lane-registry-v1",
  "registry_id": "mak-cultural-research-lanes-2026-08-20",
  "title": "MAK cultural-research-first cross-domain lanes",
  "layer": "cultural_research_first",
  "policy": {
    "shared_infrastructure": ["Project IR", "source_learning_bridge", "project_router", "mak-system-status-v1", "bounded provenance", "consumer-driven transforms"],
    "semantic_transfer_rule": "Methods, formats and provenance may be shared; domain conclusions never transfer without typed evidence.",
    "promotion_rule": "A lane advances only with a declared consumer, explicit validator and evidence whose scope matches the claim."
  },
  "lanes": [
    {
      "lane_id": "pnp_search_ecology",
      "title": "P versus NP as a representation and search hypothesis",
      "priority": 0,
      "dialects": ["mak.claim", "mak.research", "math_target"],
      "epistemic_status": "candidate",
      "source_status": "verified",
      "current_state": "implemented",
      "consumer": {"tool_id": "math_kernel", "path": "tools/math_kernel.py", "mode": "metadata_only"},
      "evidence_refs": ["knowledge/math_targets/p_vs_np_target_capsule_2026-08-19.json", "knowledge/math_targets/p_vs_np_official_statement_capture_2026-08-20.json", "knowledge/learning_cases/mak_pnp_search_ecology_2026-08-19.json"],
      "implementation": ["cultural-first Project IR", "sealed metadata ResultCards", "bounded search requests"],
      "next_gate": "Curate semantic fidelity between the official statement and formal target before truth promotion.",
      "guardrails": ["No theorem claim from folder order or absent counterexamples.", "Keep formal payloads behind trusted verifier references."]
    },
    {
      "lane_id": "tennis_decision_lab",
      "title": "Tennis as an adversarial decision, perception and physics laboratory",
      "priority": 0,
      "dialects": ["mak.tennis", "mak.event", "mak.geometry", "mak.learning"],
      "epistemic_status": "candidate",
      "source_status": "provided_bundle",
      "current_state": "partial",
      "consumer": {"tool_id": "tennis_shot_event_consumer", "path": "tools/tennis_shot_events.py", "mode": "read_only"},
      "evidence_refs": ["file:/home/mak/curatoria_inbox/MAK_TODO_SESION_2026-08-19/ARTIFACTS/MAK_TENNIS_RESEARCH_BOOTSTRAP/MANIFEST.json", "file:/home/mak/curatoria_inbox/MAK_TODO_SESION_2026-08-19/ARTIFACTS/MAK_TENNIS_RESEARCH_BOOTSTRAP/MAK_TENNIS_IMPLEMENTATION_BACKLOG.csv", "file:/home/mak/curatoria_inbox/MAK_TODO_SESION_2026-08-19/ARTIFACTS/MAK_TENNIS_RESEARCH_BOOTSTRAP/MAK_TENNIS_SOURCE_REGISTRY.json", "src/flujo/tennis/shot_events.py", "schemas/tennis/shot_event.schema.json"],
      "implementation": ["MAK-owned conservative MCP parser", "loss-aware shot_event adapter", "Project IR router consumer", "local JSONL projection CLI", "raw/hash/unknown-token preservation", "shot/state/decision schemas", "benchmark suite B0-B7"],
      "next_gate": "Add an independent second fixture or observed source before learning a general tennis policy; keep physics and counterfactuals unpromoted.",
      "guardrails": ["Preserve raw notation and unknown tokens.", "Observed human outcomes never evaluate an unexecuted MAK counterfactual.", "Broadcast 2D, fatigue and spin limits remain explicit unknowns or proxies."]
    },
    {
      "lane_id": "research_capture_scraping",
      "title": "Research capture and scraping as source acquisition, not truth",
      "priority": 0,
      "dialects": ["mak.raw", "mak.prov", "mak.research", "mak.claim"],
      "epistemic_status": "observed",
      "source_status": "partial",
      "current_state": "partial",
      "consumer": {"tool_id": "research_source_capture", "path": "tools/research_source_capture.py", "mode": "plan_only"},
      "evidence_refs": ["tools/research_job_router.py", "tools/research_source_capture.py", "cultura/mak_research/source_pipeline.py", "context/LAST_HANDOFF.md"],
      "implementation": ["bounded one-source capture gate", "source hashes and licenses", "Research job 4 gate", "discovery/capture separation"],
      "next_gate": "Resolve license review for the existing four-source capture before publication; the symbolic simulate consumer remains a model-only projection.",
      "guardrails": ["Official sources and candidates remain separate.", "A key or package does not prove a provider is operational.", "Do not clone or install candidate repositories for an unavailable consumer."]
    },
    {
      "lane_id": "deep_learning_micelio",
      "title": "Deep learning, embeddings and micelio as measured projections",
      "priority": 1,
      "dialects": ["mak.learning", "mak.event", "mak.geometry", "mak.claim"],
      "epistemic_status": "candidate",
      "source_status": "partial",
      "current_state": "partial",
      "consumer": {"tool_id": "deep_learning_gate", "path": "tools/deep_learning_gate.py", "mode": "read_only"},
      "evidence_refs": ["src/flujo/knowledge/learning_policy.py", "src/flujo/knowledge/deep_learning_gate.py", "tools/deep_learning_gate.py", "schemas/knowledge/deep_learning_task_gate.schema.json", "tools/gen_campo_iskvw.py", "schemas/micelio.schema.json", "projects/logo_clean_lab/learning/README.md"],
      "implementation": ["categorical learning policy with abstention", "deep-learning task evidence gate", "embedding projection consumers", "micelio seed/nutrient contracts"],
      "next_gate": "Provide an independent holdout for the existing logo-clean task and run its validator; no model training or semantic promotion yet.",
      "guardrails": ["An embedding is a projection, not semantic truth.", "Generated labels remain derived until independently validated.", "Do not promote weights without a declared task and holdout."]
    },
    {
      "lane_id": "transpilation_dialects",
      "title": "Dialect transforms with explicit preservation and loss",
      "priority": 1,
      "dialects": ["mak.event", "mak.prov", "mak.claim", "mak.geometry", "mak.package"],
      "epistemic_status": "candidate",
      "source_status": "provided_bundle",
      "current_state": "proposal",
      "evidence_refs": ["file:/home/mak/curatoria_inbox/MAK_TODO_SESION_2026-08-19/ARTIFACTS/MAK_TRANSPILATION_DEEP_CONNECTED/MAK_TRANSPILATION_IR.json", "file:/home/mak/curatoria_inbox/MAK_TODO_SESION_2026-08-19/ARTIFACTS/MAK_TRANSPILATION_DEEP_CONNECTED/MAK_TRANSPILATION_TRANSFORMS.csv", "file:/home/mak/curatoria_inbox/MAK_TODO_SESION_2026-08-19/ARTIFACTS/MAK_COMMON_RESEARCH_SUBSTRATE.json"],
      "implementation": ["proposal for transform registry", "loss manifests", "consumer-driven transform planning"],
      "next_gate": "Implement one registry entry and golden fixture for a loss-declared transform used by a real consumer.",
      "guardrails": ["Do not call every conversion transpilation.", "No universal schema that erases domain semantics.", "Projection and geometry never create epistemic relations."]
    },
    {
      "lane_id": "object_centric_memory",
      "title": "Object-centric events as the shared memory substrate",
      "priority": 1,
      "dialects": ["mak.object", "mak.event", "mak.prov", "mak.claim"],
      "epistemic_status": "candidate",
      "source_status": "proposal",
      "current_state": "proposal",
      "evidence_refs": ["file:/home/mak/curatoria_inbox/MAK_TODO_SESION_2026-08-19/ARTIFACTS/MAK_COMMON_RESEARCH_SUBSTRATE.json", "file:/home/mak/curatoria_inbox/MAK_TODO_SESION_2026-08-19/ARTIFACTS/MAK_RESEARCH_RELATION_GRAPH.json"],
      "next_gate": "Select one existing MAK event stream and define an object/event fixture without introducing a second datastore.",
      "guardrails": ["Shared event mechanics do not imply shared domain meaning.", "Keep source, observation, interpretation and action separate."]
    },
    {
      "lane_id": "procedural_growth_simulation",
      "title": "Procedural growth as an explicit symbolic visual model",
      "priority": 1,
      "dialects": ["mak.simulation", "mak.geometry", "mak.research", "mak.event"],
      "epistemic_status": "candidate",
      "source_status": "partial",
      "current_state": "partial",
      "consumer": {"tool_id": "research_simulation_consumer", "path": "tools/research_simulation.py", "mode": "read_only"},
      "evidence_refs": ["/home/mak/research/jobs/4/verified_interpret_result.json", "schemas/knowledge/research_simulation_manifest.schema.json", "knowledge/research_simulations/job4_lsystem_candidate_20260820.json"],
      "implementation": ["bounded deterministic L-system projection", "explicit axiom/rules/iteration manifest", "model-not-reality result marker", "symbol budget and provenance"],
      "next_gate": "Human-review the candidate visual grammar and compare a second declared grammar before any biological interpretation or publication.",
      "guardrails": ["A symbolic trajectory is simulated, never observed growth.", "Rules are input declarations, not extracted facts.", "Budget overflow abstains instead of truncating silently."]
    },
    {
      "lane_id": "xio_reels_autotelemetry",
      "title": "XIO reels, attention and explicit preference",
      "priority": 1,
      "dialects": ["mak.preference", "mak.event", "mak.research"],
      "epistemic_status": "candidate",
      "source_status": "provided_bundle",
      "current_state": "proposal",
      "evidence_refs": ["file:/home/mak/curatoria_inbox/MAK_TODO_SESION_2026-08-19/ARTIFACTS/MAK_DEEP_RESEARCH_CONNECTED/MAK_XIO_reels_autotelemetry_integration.md", "file:/home/mak/curatoria_inbox/MAK_TODO_SESION_2026-08-19/ARTIFACTS/MAK_DEEP_RESEARCH_CONNECTED/MAK_local_reels_autotelemetry.md"],
      "next_gate": "Register one raw event stream and one explicit user mark before inferring preference.",
      "guardrails": ["Dwell and replay are policy-conditioned observations, not preference truth.", "Ask selectively when an explicit label reduces uncertainty."]
    },
    {
      "lane_id": "interview_claim_pipeline",